Nombre,Estado,Partido,Correo,Comisiones
Claudia Gabriela Salas Rodríguez,Jalisco,MC,claudia.salas@diputados.gob.mx,"Vigilancia de la Auditoría Superior de la Federación, Energía, Zonas Metropolitanas"
Juan Ignacio Samperio Montaño,Estado de México,MC,juan.samperio@diputados.gob.mx,"Federalismo y Desarrollo Municipal, Educación, Desarrollo Urbano y Ordenamiento Territorial"
Miguel Ángel Sánchez Rivera,Nuevo León,MC,miguelangel.sanchez@diputados.gob.mx,"Recursos Hidráulicos, Agua Potable y Saneamiento, Gobernación y Población, Cambio Climático y Sostenibilidad"
Pablo Vázquez Ahued,Jalisco,MC,pablo.vazquez@diputados.gob.mx,"Reforma Política-Electoral, Defensa Nacional, Justicia"
Juan Ignacio Zavala Gutiérrez,Ciudad de México,MC,juan.zavala@diputados.gob.mx,"Seguridad Ciudadana, Salud, Justicia"
Guadalupe Araceli Mendoza Arias,Michoacán,INDEPENDIENTE / OTRO,araceli.mendoza@diputados.gob.mx,diversas comisiones legislativas
